{"harness":[{"image":{"digest":"sha256:aaaaaaaaaaaaaaaaaaaaaaaaaaaaaaaaaaaaaaaaaaaaaaaaaaaaaaaaaaaaaaaa","mediaType":"application/vnd.oci.image.manifest.v1+json","size":1},"imageRef":"registry.example/agentsuite/harness@sha256:aaaaaaaaaaaaaaaaaaaaaaaaaaaaaaaaaaaaaaaaaaaaaaaaaaaaaaaaaaaaaaaa","platform":{"architecture":"amd64","os":"linux"}}],"id":"default","mediaType":"application/vnd.agentsuite.build.profile.v1+json","runtimeBase":[{"image":{"digest":"sha256:aaaaaaaaaaaaaaaaaaaaaaaaaaaaaaaaaaaaaaaaaaaaaaaaaaaaaaaaaaaaaaaa","mediaType":"application/vnd.oci.image.manifest.v1+json","size":1},"imageRef":"registry.example/agentsuite/runtime-base@sha256:aaaaaaaaaaaaaaaaaaaaaaaaaaaaaaaaaaaaaaaaaaaaaaaaaaaaaaaaaaaaaaaa","platform":{"architecture":"amd64","os":"linux"}}],"schemaVersion":"1.0.0-draft","sourceEpoch":1}